{
  "$schema": "../../schemas/archetype.schema.json",
  "schemaVersion": "1.0.0",
  "id": "large",
  "extends": "standard",
  "visual": "tower.large",
  "footprintRadius": 4,
  "components": {
    "garrison": { "cap": 80 },
    "generates": { "ratePerSec": 1.5 },
    "drawsLines": { "extraSlotAbove": [10, 30] }
  }
}
